{"capabilities":["authenticated-judge-quorum","cross-project-rag","global-onboarding-shared-index","host-native-loop-graph","portable-knowledge-bundle","reviewed-directory-scan","signed-offline-update"],"migrations":["same-major-render-v1"],"ownership":["canonical-knowledge-bundle","derived-rag-index","ephemeral-backup","hive-generated-config"],"product_version":"0.9.3","projections":[".agents/skills/amend-directive/SKILL.md",".agents/skills/code-polish/SKILL.md",".agents/skills/hive-judge-package/SKILL.md",".agents/skills/hive-migrate/SKILL.md",".agents/skills/hive-update/SKILL.md",".agents/skills/knowledge-capture/SKILL.md",".agents/skills/knowledge-import/SKILL.md",".agents/skills/knowledge-maintain/SKILL.md",".agents/skills/knowledge-promote/SKILL.md",".agents/skills/knowledge-recall/SKILL.md",".agents/skills/package-review/SKILL.md",".agents/skills/product-update/SKILL.md",".agents/skills/project-refresh/SKILL.md",".agents/skills/project-setup/SKILL.md",".agents/skills/project-transition/SKILL.md",".agents/skills/prompt-refine/SKILL.md",".agents/skills/quick-answer/SKILL.md",".agents/skills/ralph-loop/SKILL.md",".agents/skills/research-best-practices/SKILL.md",".agents/skills/run-checkpoint/SKILL.md",".agents/skills/run-handoff/SKILL.md",".agents/skills/run-resume/SKILL.md",".agents/skills/ship/SKILL.md",".agents/skills/usage-guard/SKILL.md",".agents/skills/user-setup/SKILL.md"],"schema_version":1,"schemas":["action-result.schema.json","active-skills.schema.json","backup-manifest.schema.json","capability-matrix.schema.json","dispatch-brief.schema.json","historical-builtins.schema.json","historical-surfaces.schema.json","hook-consent.schema.json","judge-approval.schema.json","judge-assignment.schema.json","judge-attestation.schema.json","judge-package-request.schema.json","judge-package.schema.json","judge-quorum-request.schema.json","judge-trust-root.schema.json","judge-verdict.schema.json","knowledge-bundle-manifest.schema.json","knowledge-collection-registry.schema.json","knowledge-import-result.schema.json","knowledge-lint-result.schema.json","knowledge-page.schema.json","knowledge-query-result.schema.json","knowledge-remember-request.schema.json","knowledge-retrieval-result.schema.json","knowledge-retrieve-request.schema.json","knowledge-scan-result.schema.json","knowledge-scan-review.schema.json","knowledge-suppression.schema.json","loop-dispatch.schema.json","loop-graph.schema.json","major-release-confirmation.schema.json","migration-table.schema.json","project-registry.schema.json","prompt-refinement-input.schema.json","prompt-refinement-lifecycle.schema.json","prompt-refinement-result.schema.json","release-bundle-manifest.schema.json","release-surface-inventory.schema.json","role-handoff-request.schema.json","role-profile.schema.json","routing-decision.schema.json","routing-request.schema.json","run-checkpoint-request.schema.json","run-status.schema.json","setup-answers.schema.json","skill-catalog.schema.json","source-wiki-page.schema.json","update-journal.schema.json","update-state.schema.json","usage-snapshot.schema.json","user-setup-catalog.schema.json","user-setup.schema.json"],"skills":["amend-directive","code-polish","hive-judge-package","hive-migrate","hive-update","knowledge-capture","knowledge-import","knowledge-maintain","knowledge-promote","knowledge-recall","package-review","product-update","project-refresh","project-setup","project-transition","prompt-refine","quick-answer","ralph-loop","research-best-practices","run-checkpoint","run-handoff","run-resume","ship","usage-guard","user-setup"],"templates":[".hive/config/harness.toml"]}
