{"capabilities":["authenticated-judge-quorum","signed-offline-update"],"migrations":["same-major-render-v1"],"ownership":["ephemeral-backup","hive-generated-config"],"product_version":"0.8.0","projections":[".agents/skills/hive-judge-package/SKILL.md",".agents/skills/hive-migrate/SKILL.md",".agents/skills/hive-update/SKILL.md"],"schema_version":1,"schemas":["action-result.schema.json","backup-manifest.schema.json","major-release-confirmation.schema.json","migration-table.schema.json","platform-signing-evidence.schema.json","release-bundle-manifest.schema.json","release-surface-inventory.schema.json","update-journal.schema.json","update-state.schema.json"],"skills":["hive-judge-package","hive-migrate","hive-update"],"templates":[".hive/config/harness.toml"]}
